{"basis":"cash","buckets":[{"bucketId":"operating-cash","currency":"USD","label":"Operating cash (synthetic)"},{"bucketId":"reserve-cash","currency":"USD","label":"Reserve cash (synthetic)"}],"cutoff":"2000-03-31T23:59:59Z","demoLabel":"Demo data — not VT Infinite's financial records.","entityId":"demo","entityLabel":"Synthetic Demo Organization (fictional)","environment":"synthetic-demo","excluded":[{"description":"No account is excluded: this fictional entity has only the two synthetic cash buckets listed.","reason":"Synthetic demonstration; there is no real account inventory behind it."}],"periodEnd":"2000-03-31","periodId":"2000-Q1","periodStart":"2000-01-01","reconciliation":{"coverage":"Synthetic: operating cash matched to a synthetic bank statement through 2000-03-31; reserve cash not matched (exception syn-exc-001).","date":"2000-04-03","status":"partially-reconciled"},"restrictedFunds":[{"label":"Synthetic restricted fund A","restrictionId":"fund-a"},{"label":"Synthetic restricted fund B","restrictionId":"fund-b"}],"schema":"marrs-rover.scope.1","statement":"Synthetic demonstration data for a fictional entity. Cash activity only, on a cash basis; it shows no assets, liabilities or obligations beyond the cash movements listed."}